{"$schema":"https://json-schema.org/draft/2020-12/schema","$id":"https://schemas.jem-nexus.invalid/catalog-pipeline/v1/local-apply-authorization.schema.json","type":"object","additionalProperties":false,"required":["schema_version","rules_version","classification","fixture_only","local_only","production_allowed","publication_allowed","allow_apply","allow_resume","allow_verify","package_sha256","plan_fingerprint","dry_run_fingerprint","snapshot_fingerprint","contract_fingerprint","policy_fingerprint","operation_set_fingerprint","operation_count","allowed_operation_kinds","target_fingerprint","authorization_fingerprint"],"properties":{"schema_version":{"const":"1.0.0"},"rules_version":{"const":"jem-local-apply-v1"},"classification":{"enum":["fixture_only","local_development"]},"fixture_only":{"type":"boolean"},"local_only":{"const":true},"production_allowed":{"const":false},"publication_allowed":{"const":false},"allow_apply":{"type":"boolean"},"allow_resume":{"type":"boolean"},"allow_verify":{"type":"boolean"},"package_sha256":{"type":"string","pattern":"^[0-9a-f]{64}$"},"plan_fingerprint":{"type":"string","pattern":"^[0-9a-f]{64}$"},"dry_run_fingerprint":{"type":"string","pattern":"^[0-9a-f]{64}$"},"snapshot_fingerprint":{"type":"string","pattern":"^[0-9a-f]{64}$"},"contract_fingerprint":{"type":"string","pattern":"^[0-9a-f]{64}$"},"policy_fingerprint":{"type":"string","pattern":"^[0-9a-f]{64}$"},"operation_set_fingerprint":{"type":"string","pattern":"^[0-9a-f]{64}$"},"operation_count":{"type":"integer","minimum":0},"allowed_operation_kinds":{"type":"array","uniqueItems":true,"items":{"type":"string","minLength":1}},"target_fingerprint":{"type":"string","pattern":"^[0-9a-f]{64}$"},"authorization_fingerprint":{"type":"string","pattern":"^[0-9a-f]{64}$"}}}
