{"schema_version":"1.0.0","rules_version":"jem-local-apply-v1","classification":"fixture_only","fixture_only":true,"local_only":true,"production_allowed":false,"publication_allowed":false,"allow_apply":true,"allow_resume":true,"allow_verify":true,"package_sha256":"0000000000000000000000000000000000000000000000000000000000000000","plan_fingerprint":"0000000000000000000000000000000000000000000000000000000000000000","dry_run_fingerprint":"0000000000000000000000000000000000000000000000000000000000000000","snapshot_fingerprint":"0000000000000000000000000000000000000000000000000000000000000000","contract_fingerprint":"0000000000000000000000000000000000000000000000000000000000000000","policy_fingerprint":"0000000000000000000000000000000000000000000000000000000000000000","operation_set_fingerprint":"0000000000000000000000000000000000000000000000000000000000000000","operation_count":0,"allowed_operation_kinds":[],"target_fingerprint":"0000000000000000000000000000000000000000000000000000000000000000","authorization_fingerprint":"0000000000000000000000000000000000000000000000000000000000000000"}
